element,type,prospect,author
"Mehr Zeit, weniger Chaos: Belegmanagement ohne menschliche Fehler",headline,accountant,jens
"Mehr Zeit, weniger Chaos: Ersetzen Sie die Routinetätigkeiten mit AI",headline,accountant,jens
"Wir sagen den Routinetätigkeiten den Kampf an: Mehr Zeit, niedrigere Kosten, weniger Chaos",headline,accountant,jens
"Zu viele langweilige, zeitaufwendige Routinetätigkeiten?",headline,accountant,jens
"Sagen Sie der Ineffizienz den Kampf an",headline,accountant,jens
"Wir ersetzen Routinetätigkeiten mit AI, senken Kosten und verbannen das Chaos aus Ihrem Buchhaltungsbüro",headline,accountant,jens
"Wir sagen dem Chaos und den hohen Kosten den Kampf an",headline,accountant,jens
"Verschwenden Sie unendlich viel Zeit für das Durchforsten von E-Mail-Postfächern nach Kundenrechnungen?",headline,accountant,jens
"Genug vom Gefummel mit Kundenrechnungen?",headline,accountant,jens
"Sparen Sie Zeit, und Sie eliminieren das Chaos und den Ärger: Wir verbannen die Handarbeit aus der Rechnungserfassung",uvp,accountant,jens
