element,type,prospect,author
"Mehr Zeit, weniger Chaos: Belegmanagement ohne menschliche Fehler",headline,accountant,jens
"Mehr Zeit, weniger Chaos: Ersetzen die Routinetätigkeiten mit AI",headline,accountant,jens
"Wir sagen den Routinetätigkeiten den Kampf an: Mehr Zeit, niedrigere Kosten, weniger Chaos",headline,accountant,jens
"Zuviele langweilige, zeitaufwendige Routinetätigkeiten?",headline,accountant,jens
"Sagen Sie der Ineffizienz den Kampf an",headline,accountant,jens
"Wir ersetzen Routinetätigkeiten mit AI, senken Kosten und verbannen das Chaos aus Ihrem Buchhaltungsbüro",headline,accountant,jens
"Wir sagen dem Chaos und den hohen Kosten den Kampf an",headline,accountant,jens
"Verschwenden Sie unendlich viel Zeit für das Durchforsten von E-Mail Postfächern nach Kundenrechnungen?",headline,accountant,jens
"Genug vom händischen Gefummel mit Kundenrechnungen?",headline,accountant,jens
